{
  "@context": [
    "https://www.w3.org/ns/credentials/v2",
    "https://prm.dev/ns/policy/v1"
  ],
  "type": [
    "VerifiableCredential",
    "PersonalDataPolicy"
  ],
  "policyChainId": "urn:prm:chain:uEiAffJNBCpI9ao1XMxfFfASWJOX-aeXQW0maf_c1blRhmg",
  "version": 1,
  "previousPolicyHash": null,
  "issuer": {
    "id": "prm:737vmx23g2dbf2yy66qr2ta4a2",
    "did": "did:key:z6MkrXkKJa4ytWRY9ZtJXK3k3o9dsrLdKYC5vhRbZjZfu4Zo",
    "keyEventLog": "https://prm.app/u/ab12cd/kel.json",
    "keyEventHash": "uEiD-_1ZfWzaGEusY96EdTBwGudBdM5BYI2zz_Y9rlSg21g"
  },
  "effectiveDate": "2026-09-06T00:00:00Z",
  "jurisdictions": [
    "US-MN",
    "US"
  ],
  "rules": [
    {
      "category": "prm:observation",
      "decision": "allow",
      "note": "Lawful capture in a public place is not contested."
    },
    {
      "category": "prm:transactional",
      "decision": "conditional",
      "conditions": {
        "maxRetention": "PT0S",
        "purposes": [
          "prm:hotlist-comparison"
        ],
        "requiresLegalProcess": false,
        "note": "Immediate comparison against a lawfully constituted hotlist at the moment of capture."
      }
    },
    {
      "category": "prm:retention",
      "decision": "conditional",
      "conditions": {
        "maxRetention": "PT0S",
        "recipients": [
          "prm:none"
        ],
        "note": "Non-hit reads: delete immediately. Hit reads: retain only for the duration of the active investigation."
      }
    },
    {
      "category": "prm:location-history",
      "decision": "deny",
      "note": "No time-series record of my movements."
    },
    {
      "category": "prm:correlation",
      "decision": "deny",
      "note": "No joining to other databases or agency systems."
    },
    {
      "category": "prm:profiling",
      "decision": "deny"
    },
    {
      "category": "prm:inference",
      "decision": "deny",
      "note": "No pattern-of-life or anomalous-movement scoring."
    },
    {
      "category": "prm:third-party-sharing",
      "decision": "deny",
      "note": "No cross-agency, regional, or national sharing network."
    },
    {
      "category": "prm:sale",
      "decision": "deny"
    },
    {
      "category": "prm:commercialization",
      "decision": "deny"
    },
    {
      "category": "prm:advertising",
      "decision": "deny"
    },
    {
      "category": "prm:ai-training",
      "decision": "deny",
      "note": "Includes vendor model improvement on retained reads."
    },
    {
      "category": "prm:biometric",
      "decision": "deny",
      "note": "No processing of vehicle occupant imagery."
    },
    {
      "category": "prm:law-enforcement",
      "decision": "conditional",
      "conditions": {
        "requiresLegalProcess": true,
        "requiresNotice": true
      },
      "basisAcknowledged": [
        "court-order",
        "statutory-override"
      ]
    },
    {
      "category": "prm:emergency",
      "decision": "allow",
      "basisAcknowledged": [
        "vital-interest"
      ],
      "note": "Imminent threat to life, for the duration of the emergency."
    },
    {
      "category": "prm:deletion",
      "decision": "conditional",
      "conditions": {
        "maxRetention": "PT0S",
        "note": "Delete non-hit reads immediately; hit reads on case closure."
      }
    }
  ],
  "identifierCommitments": [
    {
      "namespace": "us-license-plate",
      "commitment": "uEiAAReBMmFMY4_NHW7ftZg40gEX8LrJVMDXnRiFjfcaM6w"
    },
    {
      "namespace": "email",
      "commitment": "uEiCSorlDTGAKZc0XcqYkUNgFVgVF6e35KQ93X4YzxkHRwA"
    }
  ],
  "requests": {
    "deletionOnPurposeCompletion": true,
    "doNotSellOrShare": true,
    "globalPrivacyControl": true
  },
  "humanReadable": {
    "mediaType": "text/markdown",
    "language": "en",
    "text": "# Personal Data Policy — Vehicle Movement Records\n\nI consent to the lawful observation of my vehicle's license plate in public places, and to the\nimmediate comparison of that plate against a lawfully constituted hotlist at the moment of capture.\n\nI object to the persistent retention of any read that does not result in a hotlist match. I object to\nthe construction of a historical record of my movements, to the correlation of these records with\nother databases, to their disclosure to other agencies or to any regional or national sharing network,\nto their sale or commercial exploitation, to their use in behavioral profiling or derived inference,\nand to their inclusion in the training or evaluation of any machine learning model.\n\nI acknowledge that a court order or a specific statutory mandate may lawfully override these\nobjections, and I do not assert otherwise. Where such a basis exists, I request written notice and\nretention limited to what that basis actually requires.\n\nIn an emergency involving an imminent threat to life, I consent to the use of this data for the\nduration of that emergency.\n\nPlease confirm receipt and state which of these restrictions your systems can and cannot honour."
  },
  "distribution": {
    "canonicalUrl": "https://prm.app/u/ab12cd",
    "machineUrl": "https://prm.app/u/ab12cd/policy.json",
    "shortUrl": "https://prm.li/9fK2xQ",
    "statusList": "https://prm.app/status/1"
  },
  "id": "urn:prm:policy:uEiBE9fuWQIzOQe08QcgbkYJdl54EKVdIlWi6GC2xmIZmqA",
  "proof": {
    "type": "DataIntegrityProof",
    "cryptosuite": "eddsa-jcs-2022",
    "created": "2026-09-06T14:07:33Z",
    "verificationMethod": "did:key:z6MkrXkKJa4ytWRY9ZtJXK3k3o9dsrLdKYC5vhRbZjZfu4Zo#z6MkrXkKJa4ytWRY9ZtJXK3k3o9dsrLdKYC5vhRbZjZfu4Zo",
    "proofPurpose": "assertionMethod",
    "proofValue": "z3ENFJnfQ2YK2cAinY8N93i947uAR8K53PfWtHwm1PbFgs9MyPr9fcWGquFxGKGaiCCNjfvLupRfxPErUEs39TYXF"
  }
}
