{
  "@context": [
    "https://www.w3.org/ns/credentials/v2",
    "https://rightsroot.org/spec/prm/ns/v1"
  ],
  "type": [
    "VerifiableCredential",
    "PersonalDataPolicy"
  ],
  "policyChainId": "urn:prm:chain:uEiB6YYylUjeUKi1bZ-dI-udT6yZh2ZK_giAfoE-eGrbkxA",
  "version": 1,
  "previousPolicyHash": null,
  "issuer": {
    "id": "prm:mijevl4d5usffzvapybo3fwaja",
    "did": "did:key:z6MkrXkKJa4ytWRY9ZtJXK3k3o9dsrLdKYC5vhRbZjZfu4Zo",
    "keyEventLog": "https://rightsroot.com/u/ab12cd/kel.json",
    "keyEventHash": "uEiBiEkqvg-0kUuagfgLtlsBINn4IOVDRsI7YQY2tj3VylQ"
  },
  "effectiveDate": "2026-09-06T00:00:00Z",
  "jurisdictions": [
    "US"
  ],
  "rules": [
    {
      "category": "prm:observation",
      "decision": "allow",
      "note": "Observation itself is not contested."
    },
    {
      "category": "prm:transactional",
      "decision": "conditional",
      "conditions": {
        "maxRetention": "PT0S",
        "purposes": [
          "dpv:ServiceProvision"
        ],
        "requiresLegalProcess": false,
        "note": "Use strictly necessary to complete an interaction I initiated."
      }
    },
    {
      "category": "prm:retention",
      "decision": "conditional",
      "conditions": {
        "maxRetention": "PT0S",
        "recipients": [
          "prm:none"
        ],
        "note": "Delete once the initiating purpose is complete."
      }
    },
    {
      "category": "prm:location-history",
      "decision": "deny"
    },
    {
      "category": "prm:correlation",
      "decision": "deny",
      "note": "No joining to other databases."
    },
    {
      "category": "prm:profiling",
      "decision": "deny"
    },
    {
      "category": "prm:inference",
      "decision": "deny"
    },
    {
      "category": "prm:third-party-sharing",
      "decision": "deny"
    },
    {
      "category": "prm:sale",
      "decision": "deny"
    },
    {
      "category": "prm:commercialization",
      "decision": "deny"
    },
    {
      "category": "prm:advertising",
      "decision": "deny"
    },
    {
      "category": "prm:ai-training",
      "decision": "deny"
    },
    {
      "category": "prm:biometric",
      "decision": "deny"
    },
    {
      "category": "prm:law-enforcement",
      "decision": "conditional",
      "conditions": {
        "requiresLegalProcess": true,
        "requiresNotice": true,
        "jurisdictions": [
          "US"
        ]
      },
      "basisAcknowledged": [
        "court-order",
        "statutory-override"
      ]
    },
    {
      "category": "prm:emergency",
      "decision": "allow",
      "basisAcknowledged": [
        "vital-interest"
      ],
      "note": "Imminent threat to life, for its duration."
    },
    {
      "category": "prm:deletion",
      "decision": "conditional",
      "conditions": {
        "maxRetention": "PT0S",
        "note": "Delete once the purpose is complete."
      }
    }
  ],
  "identifierCommitments": [
    {
      "namespace": "vin",
      "commitment": "uEiCDWH0mOPxvfHZLaHzOQMgq59GlFdhchw4gN4EZERDKmw"
    },
    {
      "namespace": "email",
      "commitment": "uEiCSorlDTGAKZc0XcqYkUNgFVgVF6e35KQ93X4YzxkHRwA"
    },
    {
      "namespace": "device-id",
      "commitment": "uEiDJAYWGMsi-Tg-hbIw8lb8dEgXdtCOKHeUyO7GOw28f7w"
    }
  ],
  "requests": {
    "deletionOnPurposeCompletion": true,
    "doNotSellOrShare": true,
    "globalPrivacyControl": true
  },
  "humanReadable": {
    "mediaType": "text/markdown",
    "language": "en",
    "text": "# Personal Data Policy\n\nThis document states the terms on which information about me may be retained and reused after it has\nbeen collected. It is a synthetic example used to pin the PRM canonicalization and signature format;\nit is not anyone's real policy and it describes no real organization.\n\nI permit observation and the use strictly necessary to complete an interaction I have initiated.\n\nI object to retention beyond that purpose, to combining these records with other databases, to\nbuilding a behavioral profile, to inferring facts about me that were never observed, to disclosure to\nother organizations, to sale or other commercial exploitation, to advertising use, and to inclusion in\nthe training or evaluation of any machine learning model.\n\nI acknowledge that a court order or a specific statutory mandate may lawfully override these\nobjections, and I do not assert otherwise.\n\nPlease confirm receipt and state which of these restrictions your systems can and cannot honour."
  },
  "distribution": {
    "canonicalUrl": "https://rightsroot.com/u/ab12cd",
    "machineUrl": "https://rightsroot.com/u/ab12cd/policy.json",
    "shortUrl": "https://rightsroot.com/p/9fK2xQ",
    "statusList": "https://rightsroot.com/status/1"
  },
  "id": "urn:prm:policy:uEiASvTFe2WZxFUfBzh6MRXtXVaabo88XnswKmvrwXP1gJQ",
  "proof": {
    "type": "DataIntegrityProof",
    "cryptosuite": "eddsa-jcs-2022",
    "created": "2026-09-06T14:07:33Z",
    "verificationMethod": "did:key:z6MkrXkKJa4ytWRY9ZtJXK3k3o9dsrLdKYC5vhRbZjZfu4Zo#z6MkrXkKJa4ytWRY9ZtJXK3k3o9dsrLdKYC5vhRbZjZfu4Zo",
    "proofPurpose": "assertionMethod",
    "proofValue": "z39dqHgmxtSkAvkzMcgAQUtDYaWZbxxKENw9Mse1nkLwuHfDZi9Po6WoScbcTz56RwaCLSoABncYj7qarAoWfRLPd"
  }
}
