{
  "@context": [
    "https://www.w3.org/ns/credentials/v2",
    "https://rightsroot.org/spec/prm/ns/v1"
  ],
  "type": [
    "VerifiableCredential",
    "PersonalDataPolicy"
  ],
  "policyChainId": "urn:prm:chain:uEiDvRgzy0aV11g-h-BuMD9gbYTrA3EP7eKrFyeOeyn_VGw",
  "version": 1,
  "previousPolicyHash": null,
  "issuer": {
    "id": "prm:s2nfbcv7jr5kcf3yopfs5dlrqa",
    "did": "did:key:z6MkfCwPTWq3SKbw4AVj7j8t8oFBiFp6CvZiTnXAw24nVkLH",
    "keyEventLog": "https://rightsroot.com/u/user0001/kel.json",
    "keyEventHash": "uEiCWmlCKv0x6oRd4c8sujXGAHMGIESmnmHdAh7hr4bFZcQ"
  },
  "effectiveDate": "2026-09-15T00:00:00Z",
  "jurisdictions": [
    "US-CA",
    "US"
  ],
  "rules": [
    {
      "category": "prm:observation",
      "decision": "allow",
      "note": "I do not object to the lawful capture of my plate in a public place at the moment it occurs."
    },
    {
      "category": "prm:transactional",
      "decision": "conditional",
      "conditions": {
        "maxRetention": "PT0S",
        "purposes": [
          "prm:hotlist-comparison"
        ],
        "jurisdictions": [
          "US-CA"
        ],
        "note": "Immediate comparison against a lawfully constituted hotlist at the moment of capture. This is the use I authorize; it completes when the comparison completes."
      }
    },
    {
      "category": "prm:law-enforcement",
      "decision": "conditional",
      "conditions": {
        "requiresLegalProcess": true,
        "requiresNotice": true,
        "maxRetention": "P60D",
        "purposes": [
          "prm:active-investigation"
        ],
        "jurisdictions": [
          "US-CA"
        ],
        "note": "Use tied to a valid, individualized investigative purpose, retained only for as long as that specific investigation requires."
      },
      "basisAcknowledged": [
        "court-order",
        "statutory-override"
      ]
    },
    {
      "category": "prm:emergency",
      "decision": "conditional",
      "conditions": {
        "requiresNotice": true,
        "note": "An imminent threat to life, for the duration of that emergency only."
      },
      "basisAcknowledged": [
        "vital-interest"
      ]
    },
    {
      "category": "prm:retention",
      "decision": "conditional",
      "conditions": {
        "maxRetention": "PT0S",
        "recipients": [
          "prm:none"
        ],
        "note": "A read that produced no hotlist match has served its purpose at the instant of comparison. I do not consent to its retention beyond that moment."
      }
    },
    {
      "category": "prm:location-history",
      "decision": "deny",
      "note": "I object to the storage of my vehicle observations as a time-series location history, and to historical search of such a record."
    },
    {
      "category": "prm:correlation",
      "decision": "deny",
      "note": "I object to aggregating these reads with one another or correlating them with records held in other databases or systems."
    },
    {
      "category": "prm:profiling",
      "decision": "deny",
      "note": "I object to the construction of any behavioral profile from where my vehicle has been."
    },
    {
      "category": "prm:inference",
      "decision": "deny",
      "note": "I object to derived movement inference: pattern-of-life analysis, travel prediction, anomaly or \"unusual movement\" scoring, and association analysis based on co-location."
    },
    {
      "category": "prm:third-party-sharing",
      "decision": "deny",
      "note": "I object to disclosure to other agencies and to participation in any regional, statewide, federal, or commercial sharing network."
    },
    {
      "category": "prm:sale",
      "decision": "deny",
      "note": "I do not consent to the sale of these records."
    },
    {
      "category": "prm:commercialization",
      "decision": "deny",
      "note": "I do not consent to commercial exploitation of these records by an agency or its vendor."
    },
    {
      "category": "prm:advertising",
      "decision": "deny"
    },
    {
      "category": "prm:ai-training",
      "decision": "deny",
      "note": "I object to the inclusion of these records in the training, fine-tuning, or evaluation of any machine learning model, including vendor product development."
    },
    {
      "category": "prm:biometric",
      "decision": "deny",
      "note": "I object to biometric processing of imagery of vehicle occupants."
    },
    {
      "category": "prm:deletion",
      "decision": "conditional",
      "conditions": {
        "maxRetention": "PT0S",
        "requiresNotice": false,
        "note": "I request deletion of non-hit reads immediately, and of investigation-related reads on closure of the specific matter that justified retaining them."
      }
    }
  ],
  "identifierCommitments": [
    {
      "namespace": "us-license-plate",
      "commitment": "uEiCBpKuuDgLZKdS3dJS0aoXC2h9lZeLGm-eEJSXZ8S6oqQ"
    },
    {
      "namespace": "email",
      "commitment": "uEiBCY7ckGV2ZrV8ehuUP0hHzeya5b3uQUwiC1MHTF387qw"
    }
  ],
  "requests": {
    "deletionOnPurposeCompletion": true,
    "doNotSellOrShare": true,
    "globalPrivacyControl": true
  },
  "humanReadable": {
    "mediaType": "text/markdown",
    "language": "en",
    "text": "# Personal Data Policy — Automated License Plate Reader Records\n\n## What I authorize\n\nI do not object to the lawful photographing of my vehicle's license plate in a public place, nor to\nthe immediate comparison of that plate against a lawfully constituted hotlist at the moment of\ncapture. I understand that is what the system is for, and I am not asking City of Whittier Police Department to stop operating\nit.\n\nWhere there is a valid, individualized investigative purpose supported by appropriate legal process,\nor a genuine emergency involving an imminent threat to life, I do not object to the use of a read\nabout my vehicle for the duration of that specific matter.\n\n## What I object to and do not consent to\n\nEverything that happens after the moment of comparison is a separate act, and I address it separately.\nI object to, and do not consent to:\n\n- retention of a read that produced no hotlist match, beyond the instant of comparison;\n- storage of my vehicle observations as a historical location record, and search of such a record;\n- aggregation of these reads with one another to reconstruct my movements over time;\n- correlation of these reads with records held in other databases or systems;\n- disclosure to other agencies, or to any regional, statewide, federal, or commercial sharing network;\n- behavioral profiling, and derived movement inference such as pattern-of-life analysis, travel\n  prediction, or \"unusual movement\" scoring;\n- sale, commercial exploitation, or advertising use;\n- inclusion in the training, fine-tuning, or evaluation of any machine learning model, including\n  vendor product development;\n- biometric processing of imagery of vehicle occupants.\n\n## What this document is, and is not\n\nThis is a record of my instructions and the date on which I gave them. It is signed, so that a third\nparty can confirm exactly what it says and that it was issued under my key. The date is my own\nstatement; independent evidence of when this document existed, where it has been obtained,\naccompanies it separately.\n\nIt does not purport to create rights that do not already exist, and I make no claim here about which\nof these restrictions California law obliges you to honour. Where a court order or a specific\nstatutory mandate requires something I have objected to, I acknowledge that it governs, and I ask only\nfor written notice and for retention limited to what that basis actually requires.\n\n## What I am asking of you\n\nPlease confirm receipt, and tell me which of these restrictions your systems can and cannot honour,\nand why. A partial answer with a citation is more useful to me than no answer.\n\nI would also like to know what reads you currently hold that are associated with my vehicle, how long\nyou retain them, and with whom they have been shared."
  },
  "distribution": {
    "canonicalUrl": "https://rightsroot.com/u/user0001",
    "machineUrl": "https://rightsroot.com/u/user0001/policy.json",
    "shortUrl": "https://rightsroot.com/p/user0001",
    "statusList": "https://rightsroot.com/status/1"
  },
  "id": "urn:prm:policy:uEiCCVYqo5goptwm4lS1RN_8WgOwJ5A8un4JTasreIyS9JA",
  "proof": {
    "type": "DataIntegrityProof",
    "cryptosuite": "eddsa-jcs-2022",
    "created": "2026-09-15T17:00:00Z",
    "verificationMethod": "did:key:z6MkfCwPTWq3SKbw4AVj7j8t8oFBiFp6CvZiTnXAw24nVkLH#z6MkfCwPTWq3SKbw4AVj7j8t8oFBiFp6CvZiTnXAw24nVkLH",
    "proofPurpose": "assertionMethod",
    "proofValue": "ztzZerzsxiUpKZaisQLM2fcW1qJ2omcDU24tuaRiF3KaCRaeJqdjHGoqzGchvAQUYSoYHytTZFDGmCXzo8ugZAA9"
  }
}